{
  "model_id": "apple/FastVLM-0.5B",
  "compression": {
    "weight_dtype": "fp16",
    "activation_dtype": null,
    "group_size": null,
    "kv_cache_dtype": null,
    "sparsity": null
  },
  "input_resolution": null,
  "vision_token_budget": null,
  "runtime_backend": "pytorch_mps",
  "decode_strategy": "greedy",
  "decode_top_k": null,
  "speculative_draft_model_id": null,
  "dataset_hash": "6d506216aa5bad159f167e2535293b4e5ec8e1073b64449d30b66b460ebf6da0",
  "target_device_id": "mac_mini_m4_16gb",
  "notes": "Task 2.2 quality eval — POPE 100-example slice"
}