{
  "model_id": "liquid-ai/lfm2-vl-450m",
  "compression": {
    "weight_dtype": "fp16",
    "activation_dtype": null,
    "group_size": null,
    "kv_cache_dtype": null,
    "sparsity": null
  },
  "input_resolution": 336,
  "vision_token_budget": 256,
  "runtime_backend": "mlx",
  "decode_strategy": "greedy",
  "decode_top_k": null,
  "speculative_draft_model_id": null,
  "dataset_hash": "e3adc60b76b266502fc78e95829f0850f059323a1b2d183a67fb10a982eadf20",
  "target_device_id": "iphone_16_pro",
  "notes": "FP16 baseline — no compression, establishes quality ceiling for LFM2-VL-450M on iPhone"
}
