{
  "model_id": "openbmb/MiniCPM-V-4.6",
  "compression": {
    "weight_dtype": "fp16",
    "activation_dtype": null,
    "group_size": null,
    "kv_cache_dtype": null,
    "sparsity": null
  },
  "input_resolution": null,
  "vision_token_budget": null,
  "runtime_backend": "pytorch_mps",
  "decode_strategy": "greedy",
  "decode_top_k": null,
  "speculative_draft_model_id": null,
  "dataset_hash": "32dec6ca51972969a0828a34480bc05f725b05c163411e9a3759f5d3c57d9d22",
  "target_device_id": "mac_mini_m4_16gb",
  "notes": "Task 2.2 quality eval — MMBench_DEV_EN 20-example slice"
}